Query,Result Number,Title,Link,Snippet
espp,1,ESPP: What is an ESPP and how does it work | Fidelity,"https://www.fidelity.com/learning-center/personal-finance/what-is-an-ESPP#:~:text=ESPP%20stands%20for%20employee%20stock,a%20set%20schedule%20over%20time.",N/A
espp,2,Employee Stock Purchase Plan (ESPP): What It Is and ...,https://www.investopedia.com/terms/e/espp.asp,"An employee stock purchase plan (ESPP) is a company-run program in which participating employees can purchase company stock directly, at a discounted price."
espp,3,What are Employee Stock Purchase Plans (ESPPs)?,https://www.schwab.com/learn/story/employee-stock-purchase-plans-guide,"Jul 16, 2024 — An employee stock purchase plan (ESPP) 1 is an optional program that allows you to buy shares of your company's stock at a discounted price."
espp,4,Employee stock purchase plans,https://www.computershare.com/us/business/employee-share-plans/espp,An Employee Stock Purchase Plan (ESPP) is the easiest and often the most cost-effective way for employees to purchase shares in your company.
espp,5,Employee Stock Purchase Plans (ESPP),https://www.esopassociation.org/articles/employee-stock-purchase-plans,"Employee stock purchase plans (ESPPs) enable employees to buy company stock at a discounted rate, such as 15 percent. The plans offer a potential financial ..."
espp,6,Employee stock purchase plan – ESPP (Infographic ...,https://www.globalshares.com/insights/employee-stock-purchase-plan-espp/,"Feb 29, 2024 — An ESPP (employee stock purchase plan) allows employees to use after-tax wages to acquire their company's shares, usually at a discount of up to ..."
espp,7,ESPP Pros and Cons: Should You Invest in Your ...,https://simplicitywm.com/should-you-invest-in-your-companys-employee-stock-purchase-plan-espp/,"An Employee Stock Purchase Plan (ESPP) is a company-sponsored program that allows employees to purchase company stock, often at a discounted price."
espp,8,Employee stock purchase plan (ESPP),https://benefits.adobe.com/us/financial/employee-stock-purchase-plan-espp,How it works. You can set aside up to 25% of your compensation through payroll deductions to purchase Adobe stock every six months at a price at least 15% below ...
espp,9,SAIC Employee Stock Purchase Plan (ESPP),https://www.saic.com/sites/default/files/2019-03/ESPP%20EGL%20FAQs.pdf,Participation in the ESPP allows you to purchase shares of common stock of the Company. (referred to as Company shares) through automatic payroll deductions.
espp,10,Employee Stock Purchase Plan (ESPP) Design,https://www.equitymethods.com/hr-advisory/employee-stock-purchase-plan-espp-design/,"ESPPs are back in vogue. These programs, which allow employees to purchase shares in the company at a discount, are a potentially valuable benefit for ..."
long term incentive plan,1,A Quick Guide To Long-Term Incentive Plans (LTIPs),"https://www.globalshares.com/insights/long-term-incentive-plan-design-what-you-need-to-know/#:~:text=A%20long%2Dterm%20incentive%20plan%20(LTIP%20or%20LTI%20plan),years%20to%20stimulate%20ongoing%20progress.",N/A
long term incentive plan,2,"Long-Term Incentives, the Basics",https://www.mercer.com/en-us/insights/total-rewards/total-rewards-strategy/long-term-incentives-the-basics/,"Long-term incentives, or LTI as they're often called, are a valuable part of a total compensation package both for delivering rewards and focusing employees ..."
long term incentive plan,3,Long-Term Incentive Plan (LTIP) Definition and Types,https://www.investopedia.com/terms/l/long_term_incentive-plan.asp,A long-term incentive plan (LTIP) is a company policy that rewards employees for reaching specific goals that lead to increased shareholder value.
long term incentive plan,4,Long Term Incentive Plans and Deferred Bonus Plans,https://www.twobirds.com/-/media/pdfs/expertise/employment/employment-incentive/long-term-incentive-plans-and-deferred-bonus-plans.pdf,"Long Term Incentive Plans (""LTIPs"") (also sometimes referred to as (""Performance Share Plans"") are the most popular form of long term share award for senior ..."
long term incentive plan,5,"Long-term incentives, the basics | Mercer",https://www.imercer.com/articleinsights/Long-term-incentives-the-basics,Long-term incentives (LTI) are a valuable part of a total compensation package both for delivering rewards and focusing employees on desired future outcomes ...
long term incentive plan,6,Long Term Incentive Plans (LTIPs) and Management ...,https://www.bdo.co.uk/en-gb/insights/tax/global-employer-services/ltips-and-mips,"Sep 16, 2024 — LTIP is a term that refers to delayed compensation strategies that a business may use to motivate employees over an extended period of time."
long term incentive plan,7,Long-Term Incentive (LTI) Compensation: The Basics,https://www.meridiancp.com/insights/long-term-incentive-lti-compensation-the-basics/,"Feb 12, 2024 — LTIPs are structured reward systems aimed at motivating and retaining key employees over a time period greater than 12 months."
long term incentive plan,8,A Comprehensive Guide to Long-Term Incentive Plans,https://hrsoft.com/a-comprehensive-guide-to-long-term-incentive-plans/,"Mar 5, 2024 — Long-term incentive plan (LTIP) is a type of employee compensation plan designed to recognize, reward, and motivate employees for fulfilling the ..."
long term incentive plan,9,Long Term Incentive Plan - A Guide to LTIP,https://www.decusoft.com/what-is-a-long-term-incentive-plan-ltip/,Long-term incentives are earned based on the achievement of goals over a longer period of time. The goals may be based on stock price or business performance.
equity compensation,1,What is Equity Compensation? What You Need to Know,"https://archerim.com/what-is-equity-compensation/#:~:text=To%20put%20it%20simply%3A%20equity,in%20place%20of%2C%20base%20salary.",N/A
equity compensation,2,"Equity Compensation: Definition, How It Works, Types of ...",https://www.investopedia.com/terms/e/equity-compensation.asp,"Equity compensation is non-cash pay that is offered to employees, including options, restricted stock, and performance shares."
equity compensation,3,"Equity Compensation: Pros & Cons, Types and How it Works",https://www.globalshares.com/insights/what-is-equity-compensation/,"Oct 3, 2023 — Equity compensation, or stock-based compensation, is a type of non-cash pay that a company offers to employees to partake in ownership of ..."
equity compensation,4,What Is Equity Compensation & How Does It Work?,https://www.paychex.com/articles/human-resources/what-is-equity-compensation,"Oct 25, 2023 — With an equity compensation plan, employees may be offered shares outright or offered the opportunity to purchase shares at a discounted rate ..."
equity compensation,5,How to Maximize Equity Compensation,https://www.plancorp.com/equity-compensation,"Equity compensation encompasses a range of programs, including stock options, restricted stock units, and employee stock purchase plans."
equity compensation,6,Equity Compensation for Employees,https://www.morganstanley.com/atwork/employees/equity-compensation,Understand your equity compensation and make the most of your workplace benefits. We can help you navigate every step of the way. Learn more now.
equity compensation,7,Equity Compensation: A Guide for Founders and Employees,https://www.harnesswealth.com/articles/the-alphabet-soup-of-equity-compensation/,"Apr 2, 2024 — Equity compensation is paid out to employees in various forms, such as stock options, restricted stock units (RSUs), or shares through an ..."
equity compensation,8,The Benefits of Accepting Equity as Compensation,https://www.business.com/articles/equity-as-compensation/,"Jan 29, 2024 — Equity compensation is a strategy used to improve a business's cash flow. Instead of a full salary, the employee is given a partial stake in ..."
equity compensation,9,Understanding Equity Compensation: A Comprehensive ...,https://www.brightonjones.com/blog/understanding-equity-compensation-a-comprehensive-guide/,"Apr 16, 2024 — Equity compensation is a form of remuneration provided by businesses to their employees. It involves the distribution of company shares or ..."
equity compensation,10,Equity Compensation—It's Not Just Fun Money,https://www.schwab.com/learn/story/equity-compensation-its-not-just-fun-money,"Jan 17, 2024 — Employers use equity compensation to not only attract, but also to retain talent, so company stock is usually granted over time. Let's say you' ..."
stock plan administration,1,"Stock plan administration: Scope, methods, pros and cons",https://www.globalshares.com/insights/equity-plan-administration/,N/A
stock plan administration,2,Stock Plan Administration,https://www.naspp.com/resources/topics/stock-plan-administration,Browse our resources designed to help create and maintain best practices in administering your company's stock plan. Search results not ...
stock plan administration,3,Equity Administration for Public Companies,https://www.morganstanley.com/atwork/equity-administration-public-companies,"Learn how Morgan Stanley at Work helps public companies manage equity plans with confidence. Manage your equity plan in one place, in real time."
stock plan administration,4,Stock Plan Administrator: What Is It? and How to Become ...,https://www.ziprecruiter.com/career/Stock-Plan-Administrator/What-Is-How-to-Become,"Qualifications for a stock plan administrator include a bachelor's degree in human resources or accounting. Job experience related to employee compensation, ..."
stock plan administration,5,Growing Your Career As A Stock Plan Administrator,https://www.naspp.com/blog/growing-your-career-as-a-stock-plan-administrator,"Aug 7, 2024 — This role involves ensuring that equity grants are accurately recorded, vesting schedules are tracked, and transactions are processed smoothly."
stock plan administration,6,Stock Plan Services | Charles Schwab,https://workplacefinancialservices.schwab.com/stock-plans,"Stock Plan Services makes plan administration easy by combining powerful technology, education for your employees, and support from real humans."
stock plan administration,7,Stock Plan Services and Solutions for Your Business,https://business.bofa.com/en-us/content/workplace-benefits/solutions-and-services/stock-plan-services.html,"Bank of America's stock plan services through Merrill, deliver the experience, technology and personal service that can help meet virtually all your stock plan ..."
stock plan administration,8,Stock Plan Administration | Equity Management Services,https://www.fidelityworkplace.com/s/stockplanservices,Explore Fidelity's comprehensive stock plan administration and equity management solutions complete with the tools and support needed to manage your account ...
stock plan administration,9,Five improvements you'll notice when you outsource your ...,https://www.computershare.com/us/equity-advisory-insights/improvements-when-you-outsource-stock-plan-administration,"Outsourcing your stock plan administration saves you time, mitigates risk, and frees up your valuable in-house human resources to focus on your ultimate goal of ..."
stock plan administration software,1,10 Best Equity Management Software for Startups in 2024,https://www.cakeequity.com/guides/best-equity-management-software,Top equity management software in 2023 · Carta · LTSE Equity · Pulley · Shareworks · Orchestra · SeedLegals · Capdesk · Vestd.
stock plan administration software,2,Stock Plan Administration Software [+Free eBook],https://www.globalshares.com/insights/stock-plan-administration-software/,"Mar 6, 2024 — Stock plan administration software simplifies the administration of equity awards and employee share plans in a company. Read more."
stock plan administration software,3,Top Stock Option Plan Administration Software 2024,https://www.trustradius.com/stock-option-plan-administration,Carta is an equity management platform that helps private companies manage their cap tables and issue securities electronically.
stock plan administration software,4,OptionTrax By Empower | The Most Flexible Stock Plan Platform,https://www.optiontrax.com/,Fully-featured equity management tools and services that meet the needs of all your stakeholders and help you to get back to business.
stock plan administration software,5,Best Equity Management Software 2024,https://www.capterra.com/equity-management-software/,"Equity management solution that helps businesses run deal scenarios, calculate dilution impact, monitor stock awards and more."
stock plan administration software,6,Certent Equity Management,https://insightsoftware.com/certent/equity-management-software/,Simplify all Aspects of Stock Administration and Reporting ... Offload your day-to-day equity administration to our expert team of certified equity professionals.
stock plan administration software,7,Best stock option management software for your company,https://eqvista.com/stock-option-management-software/,Stock option plan management software is created to help you track and manage all the stock options in the company.
stock plan administration software,8,Customized Equity Compensation Solutions | EQ,https://equiniti.com/us/public/equity-plan-solutions/,"From stock options to employee stock purchase plans, administrative services to executive support, our industry-leading software platform simplifies the process ..."
stock plan administration software,9,Best Equity Management Software: User Reviews from ...,https://www.g2.com/categories/equity-management,"Equity management software helps in managing ownership of the company in relation to stakeholders of a company. It helps in tracking shares, communicating with ..."
stock plan administration software,10,Employee Stock Option Management Software,https://astrella.com/employee-stock-option-management-software/,"Astrella provides a stock option management software to help you manage up-to-the-minute information about equity grants, vesting schedules, and settlement."
